{
  "$schema": "https://json-schema.org/draft/2020-12/schema",
  "$id": "https://schemas.ukma.dev/v1/system.cancel_job.request.schema.json",
  "title": "system.cancel_job Request",
  "type": "object",
  "additionalProperties": false,
  "required": [
    "api_version",
    "operation",
    "context",
    "input"
  ],
  "properties": {
    "api_version": {
      "const": "1"
    },
    "operation": {
      "const": "ukma.system.cancel_job.v1"
    },
    "context": {
      "$ref": "shared.schema.json#/$defs/RequestContext"
    },
    "input": {
      "type": "object",
      "additionalProperties": false,
      "properties": {
        "job_id": {
          "$ref": "shared.schema.json#/$defs/ID"
        },
        "reason": {
          "type": "string",
          "minLength": 1,
          "maxLength": 2000
        }
      },
      "required": [
        "job_id",
        "reason"
      ]
    }
  }
}
