{
  "api_version": "1",
  "operation": "ukma.system.cancel_job.v1",
  "context": {
    "request_id": "x",
    "trace_id": "x",
    "scope": {
      "tenant_id": "x",
      "project_id": "x"
    },
    "principal_id": "x",
    "scopes": [],
    "consistency": "eventual"
  },
  "input": {
    "job_id": "x",
    "reason": "x"
  }
}
